
mysql> CREATE TABLE suppliers( s_id varchar(20) not null, s_name varchar(50) not null, contact varchar(12) not null, city varchar(30) not null, primary key (s_id));
Query OK, 0 rows affected (4.08 sec)

mysql> Describe suppliers;
+---------+-------------+------+-----+---------+-------+
| Field   | Type        | Null | Key | Default | Extra |
+---------+-------------+------+-----+---------+-------+
| s_id    | varchar(20) | NO   | PRI | NULL    |       |
| s_name  | varchar(50) | NO   |     | NULL    |       |
| contact | varchar(12) | NO   |     | NULL    |       |
| city    | varchar(30) | NO   |     | NULL    |       |
+---------+-------------+------+-----+---------+-------+
4 rows in set (0.14 sec)

mysql> create table orderss( o_id int not null, customer_name varchar(50) not null, or_dates date not null,primary key (o_id));
Query OK, 0 rows affected (0.83 sec)

mysql> describe orders;
ERROR 1146 (42S02): Table 'pharma.orders' doesn't exist
mysql> describe orderss;
+---------------+-------------+------+-----+---------+-------+
| Field         | Type        | Null | Key | Default | Extra |
+---------------+-------------+------+-----+---------+-------+
| o_id          | int(11)     | NO   | PRI | NULL    |       |
| customer_name | varchar(50) | NO   |     | NULL    |       |
| or_dates      | date        | NO   |     | NULL    |       |
+---------------+-------------+------+-----+---------+-------+
3 rows in set (0.08 sec)

mysql> 

mysql> create table product ( p_id varchar(10)  not null, pr_name varchar(30) not null, units int(10) not null, unit_price int(10) not null, type varchar(40) not null, s_id varchar(20) not null, key (s_id), foreign key (s_id) references suppliers (s_id) on delete cascade, primary key (p_id));
Query OK, 0 rows affected (1.18 sec)

mysql> describe product;
+------------+-------------+------+-----+---------+-------+
| Field      | Type        | Null | Key | Default | Extra |
+------------+-------------+------+-----+---------+-------+
| p_id       | varchar(10) | NO   | PRI | NULL    |       |
| pr_name    | varchar(30) | NO   |     | NULL    |       |
| units      | int(10)     | NO   |     | NULL    |       |
| unit_price | int(10)     | NO   |     | NULL    |       |
| type       | varchar(40) | NO   |     | NULL    |       |
| s_id       | varchar(20) | NO   | MUL | NULL    |       |
+------------+-------------+------+-----+---------+-------+
6 rows in set (0.04 sec)

mysql> 

mysql> create table order_detail( p_id varchar(10) not null, o_id int(11) not null, units_purchased int not null, key (p_id), key (o_id), foreign key (p_id) references product (p_id) on delete cascade, foreign key (o_id) references orderss (o_id) on delete cascade);
Query OK, 0 rows affected (1.04 sec)

mysql> describe order_detail;
+-----------------+-------------+------+-----+---------+-------+
| Field           | Type        | Null | Key | Default | Extra |
+-----------------+-------------+------+-----+---------+-------+
| p_id            | varchar(10) | NO   | MUL | NULL    |       |
| o_id            | int(11)     | NO   | MUL | NULL    |       |
| units_purchased | int(11)     | NO   |     | NULL    |       |
+-----------------+-------------+------+-----+---------+-------+
3 rows in set (0.09 sec)




mysql> insert into suppliers values ('312','Alliance Pharmaceuticals','0313-7654321','Peshawar');
Query OK, 1 row affected (0.11 sec)

mysql> insert into suppliers values ('320','Munir Brothers','0321-1234567','karachi');
Query OK, 1 row affected (0.26 sec)

mysql> insert into suppliers values ('478','Abbot Pharmaceuticals','0313-9876543','Lahore');
Query OK, 1 row affected (0.22 sec)

mysql> insert into suppliers values ('657','Sanofi Aventis','0333-5632476','Islamabad');
Query OK, 1 row affected (0.22 sec)

mysql> insert into suppliers values ('987','Ferozsons Laboratories','0301-1934257','Peshawar');
Query OK, 1 row affected (0.15 sec)

mysql> Select * from suppliers;
+------+--------------------------+--------------+-----------+
| s_id | s_name                   | contact      | city      |
+------+--------------------------+--------------+-----------+
| 312  | Alliance Pharmaceuticals | 0313-7654321 | Peshawar  |
| 320  | Munir Brothers           | 0321-1234567 | karachi   |
| 478  | Abbot Pharmaceuticals    | 0313-9876543 | Lahore    |
| 657  | Sanofi Aventis           | 0333-5632476 | Islamabad |
| 987  | Ferozsons Laboratories   | 0301-1934257 | Peshawar  |
+------+--------------------------+--------------+-----------+
5 rows in set (0.00 sec)




mysql> insert into orderss values (22,'Waleed Ali','2014-11-25');
Query OK, 1 row affected (0.83 sec)

mysql> insert into orderss values (23,'Azhar Akbar','2014-12-02');
Query OK, 1 row affected (0.14 sec)

mysql> insert into orderss values (24,'shahzeb khan','2014-12-05');
Query OK, 1 row affected (0.09 sec)

mysql> insert into orderss values (25,'javed iqbal','2014-01-15');
Query OK, 1 row affected (0.15 sec)

mysql> insert into orderss values (26,'Tariq khan','2015-06-25');
Query OK, 1 row affected (0.07 sec)

mysql> delete from orderss where o_id = 25;
Query OK, 1 row affected (0.48 sec)

mysql> insert into orderss values (25,'javed iqbal','2015-01-15');
Query OK, 1 row affected (0.10 sec)

mysql> select * from orderss;
+------+---------------+------------+
| o_id | customer_name | or_dates   |
+------+---------------+------------+
|   22 | Waleed Ali    | 2014-11-25 |
|   23 | Azhar Akbar   | 2014-12-02 |
|   24 | shahzeb khan  | 2014-12-05 |
|   25 | javed iqbal   | 2015-01-15 |
|   26 | Tariq khan    | 2015-06-25 |
+------+---------------+------------+
5 rows in set (0.02 sec)

mysql> 





mysql> 
mysql> insert into product values ('1005','Ponstan',100,15,'Tablets','312');
Query OK, 1 row affected (0.14 sec)

mysql> 
mysql> insert into product values ('1421','Brufen',25,35,'syrup','657');
Query OK, 1 row affected (0.16 sec)

mysql> insert into product values ('3215','Avil',122,26,'syrup','478');
Query OK, 1 row affected (0.10 sec)

mysql> insert into product values ('1215','Flagyl',42,30,'Tablets','987');
Query OK, 1 row affected (0.19 sec)

mysql> 
mysql> insert into product values ('7513','Avil',140,20,'Injection','478');
Query OK, 1 row affected (0.14 sec)

mysql> insert into product values ('1216','Flagyl',10,35,'syrup','987');
Query OK, 1 row affected (0.13 sec)

mysql> insert into product values ('1007','Disprin',98,15,'Tablets','320');
Query OK, 1 row affected (0.09 sec)

mysql>  select * from product;
+------+---------+-------+------------+-----------+------+
| p_id | pr_name | units | unit_price | type      | s_id |
+------+---------+-------+------------+-----------+------+
| 1005 | Ponstan |   100 |         15 | Tablets   | 312  |
| 1007 | Disprin |    98 |         15 | Tablets   | 320  |
| 1215 | Flagyl  |    42 |         30 | Tablets   | 987  |
| 1216 | Flagyl  |    10 |         35 | syrup     | 987  |
| 1421 | Brufen  |    25 |         35 | syrup     | 657  |
| 3215 | Avil    |   122 |         26 | syrup     | 478  |
| 7513 | Avil    |   140 |         20 | Injection | 478  |
+------+---------+-------+------------+-----------+------+
7 rows in set (0.04 sec)

mysql> 











mysql>  insert into order_detail values ('1007',22,5);
Query OK, 1 row affected (0.11 sec)

mysql>  insert into order_detail values ('1216',22,1);
Query OK, 1 row affected (0.13 sec)

mysql>  insert into order_detail values ('1005',22,4);
Query OK, 1 row affected (0.10 sec)

mysql>  insert into order_detail values ('1421',23,1);
Query OK, 1 row affected (0.15 sec)

mysql> insert into order_detail values ('1005',23,1);
Query OK, 1 row affected (0.09 sec)

mysql>  insert into order_detail values ('3215',23,2);
Query OK, 1 row affected (0.06 sec)

mysql>  insert into order_detail values ('7513',23,3);
Query OK, 1 row affected (0.04 sec)

mysql>  insert into order_detail values ('1421',24,2);
Query OK, 1 row affected (0.10 sec)

mysql> insert into order_detail values ('1215',24,1);
Query OK, 1 row affected (0.07 sec)

mysql>  insert into order_detail values ('1421',26,3);
Query OK, 1 row affected (0.13 sec)

mysql>  insert into order_detail values ('1215',26,1);
Query OK, 1 row affected (0.09 sec)

mysql>   insert into order_detail values ('1005',25,5);
Query OK, 1 row affected (0.03 sec)

mysql>  select * from order_detail;
+------+------+-----------------+
| p_id | o_id | units_purchased |
+------+------+-----------------+
| 1007 |   22 |               5 |
| 1216 |   22 |               1 |
| 1005 |   22 |               4 |
| 1421 |   23 |               1 |
| 1005 |   23 |               1 |
| 3215 |   23 |               2 |
| 7513 |   23 |               3 |
| 1421 |   24 |               2 |
| 1215 |   24 |               1 |
| 1421 |   26 |               3 |
| 1215 |   26 |               1 |
| 1005 |   25 |               5 |
+------+------+-----------------+
12 rows in set (0.00 sec)

mysql> 
mysql> 
mysql> 


#
#
#    Actual quries
#
#
1)
mysql> Select * from orderss,product p, order_detail od Where od.p_id=p.p_id AND pr_name LIKE 'Flagyl' AND type LIKE 'Syrup' AND od.o_id=orderss.o_id;
+------+---------------+------------+------+---------+-------+------------+-------+------+------+------+-----------------+
| o_id | customer_name | or_dates   | p_id | pr_name | units | unit_price | type  | s_id | p_id | o_id | units_purchased |
+------+---------------+------------+------+---------+-------+------------+-------+------+------+------+-----------------+
|   22 | Waleed Ali    | 2014-11-25 | 1216 | Flagyl  |    10 |         35 | syrup | 987  | 1216 |   22 |               1 |
+------+---------------+------------+------+---------+-------+------------+-------+------+------+------+-----------------+
1 row in set (0.02 sec)

mysql> Select orderss.o_id,customer_name, or_date from orderss,product p, order_detail od Where od.p_id=p.p_id AND pr_name LIKE 'Flagyl' AND type LIKE 'Syrup' AND od.o_id=orderss.
ERROR 1054 (42S22): Unknown column 'or_date' in 'field list'
mysql> Select orderss.o_id,customer_name, or_dates from orderss,product p, order_detail od Where od.p_id=p.p_id AND pr_name LIKE 'Flagyl' AND type LIKE 'Syrup' AND od.o_id=orderss.o_id;
+------+---------------+------------+
| o_id | customer_name | or_dates   |
+------+---------------+------------+
|   22 | Waleed Ali    | 2014-11-25 |
+------+---------------+------------+
1 row in set (0.00 sec)

mysql> 





3)
mysql> select p.s_id,s.s_name, pr_name from suppliers s,product p where s.s_id = p.s_id AND s.s_name="Munir Brothers";
+------+----------------+---------+
| s_id | s_name         | pr_name |
+------+----------------+---------+
| 320  | Munir Brothers | Disprin |
+------+----------------+---------+
1 row in set (0.11 sec)

mysql> 


4)
mysql> 
mysql> Delete From product where pr_name LIKE 'Avil';
Query OK, 2 rows affected (0.35 sec)

mysql> select * from product;
+------+---------+-------+------------+---------+------+
| p_id | pr_name | units | unit_price | type    | s_id |
+------+---------+-------+------------+---------+------+
| 1005 | Ponstan |   100 |         15 | Tablets | 312  |
| 1007 | Disprin |    98 |         15 | Tablets | 320  |
| 1215 | Flagyl  |    42 |         30 | Tablets | 987  |
| 1216 | Flagyl  |    10 |         35 | syrup   | 987  |
| 1421 | Brufen  |    25 |         35 | syrup   | 657  |
+------+---------+-------+------------+---------+------+
5 rows in set (0.00 sec)

mysql> 


5)

mysql> select pr_name, s_name from product , suppliers where city="Peshawar";
+---------+--------------------------+
| pr_name | s_name                   |
+---------+--------------------------+
| Ponstan | Alliance Pharmaceuticals |
| Ponstan | Ferozsons Laboratories   |
| Disprin | Alliance Pharmaceuticals |
| Disprin | Ferozsons Laboratories   |
| Flagyl  | Alliance Pharmaceuticals |
| Flagyl  | Ferozsons Laboratories   |
| Flagyl  | Alliance Pharmaceuticals |
| Flagyl  | Ferozsons Laboratories   |
| Brufen  | Alliance Pharmaceuticals |
| Brufen  | Ferozsons Laboratories   |
+---------+--------------------------+
10 rows in set (0.00 sec)

6)
mysql> 
mysql> Select p.pr_name, s.s_name,count(p.p_id) from product p,suppliers s where s_name Like "Sanofi Aventis" AND s.s_id=p.s_id;
+---------+----------------+---------------+
| pr_name | s_name         | count(p.p_id) |
+---------+----------------+---------------+
| Brufen  | Sanofi Aventis |             1 |
+---------+----------------+---------------+
1 row in set (0.00 sec)

mysql> 





